{
  "schema_version": "state_ir_v1",
  "diagram_type": "state",
  "layout": "auto",
  "title": "fig_6_4_2",
  "states": [
    "S0",
    "S1",
    "S2",
    "S3",
    "S4",
    "S5",
    "S6",
    "S7",
    "S8",
    "S9",
    "S10",
    "S11",
    "S12"
  ],
  "transitions": [
    {
      "from": "S0",
      "to": "S1",
      "label": "/0"
    },
    {
      "from": "S1",
      "to": "S2",
      "label": "/0"
    },
    {
      "from": "S2",
      "to": "S3",
      "label": "/0"
    },
    {
      "from": "S3",
      "to": "S4",
      "label": "/0"
    },
    {
      "from": "S4",
      "to": "S5",
      "label": "/0"
    },
    {
      "from": "S5",
      "to": "S6",
      "label": "/0"
    },
    {
      "from": "S6",
      "to": "S7",
      "label": "/0"
    },
    {
      "from": "S7",
      "to": "S8",
      "label": "/0"
    },
    {
      "from": "S8",
      "to": "S9",
      "label": "/0"
    },
    {
      "from": "S9",
      "to": "S10",
      "label": "/0"
    },
    {
      "from": "S10",
      "to": "S11",
      "label": "/0"
    },
    {
      "from": "S11",
      "to": "S12",
      "label": "/0"
    },
    {
      "from": "S12",
      "to": "S0",
      "label": "/1"
    }
  ]
}
