{
  "schema_version": "state_ir_v1",
  "diagram_type": "state",
  "layout": "auto",
  "title": "fig_6_4_14",
  "states": [
    "S0",
    "S1",
    "S2"
  ],
  "transitions": [
    {
      "from": "S0",
      "to": "S0",
      "label": "00/00"
    },
    {
      "from": "S0",
      "to": "S1",
      "label": "01/00"
    },
    {
      "from": "S0",
      "to": "S2",
      "label": "10/00"
    },
    {
      "from": "S1",
      "to": "S1",
      "label": "00/00"
    },
    {
      "from": "S1",
      "to": "S2",
      "label": "01/00"
    },
    {
      "from": "S1",
      "to": "S0",
      "label": "10/10"
    },
    {
      "from": "S2",
      "to": "S2",
      "label": "00/00"
    },
    {
      "from": "S2",
      "to": "S0",
      "label": "01/10"
    },
    {
      "from": "S2",
      "to": "S0",
      "label": "10/11"
    }
  ]
}
