{
  "schema_version": "state_ir_v1",
  "diagram_type": "state",
  "layout": "free",
  "title": "fig_6_2_2",
  "show_title": false,
  "legend": {
    "state_label": "Q3Q2Q1",
    "edge_label": "/Y"
  },
  "states": ["000", "001", "010", "011", "100", "101", "110", "111"],
  "positions": {
    "000": [70, 70],
    "001": [180, 70],
    "010": [290, 70],
    "011": [400, 70],
    "111": [70, 210],
    "110": [180, 210],
    "101": [290, 210],
    "100": [400, 210]
  },
  "transitions": [
    { "from": "000", "to": "001", "label": "/0" },
    { "from": "001", "to": "010", "label": "/0" },
    { "from": "010", "to": "011", "label": "/0" },
    { "from": "011", "to": "100", "label": "/0" },
    { "from": "100", "to": "101", "label": "/0" },
    { "from": "101", "to": "110", "label": "/0" },
    { "from": "110", "to": "000", "label": "/1" },
    { "from": "111", "to": "000", "label": "/1" }
  ]
}
