{
  "schema_version": "state_ir_v1",
  "diagram_type": "state",
  "layout": "auto",
  "title": "fig_6_3_9",
  "states": [
    "0000",
    "0001",
    "0010",
    "0011",
    "0100",
    "0101",
    "0110",
    "0111",
    "1000",
    "1001",
    "1010",
    "1011",
    "1100",
    "1101",
    "1110",
    "1111"
  ],
  "transitions": [
    {
      "from": "0000",
      "to": "0001",
      "label": "/0"
    },
    {
      "from": "0001",
      "to": "0010",
      "label": "/0"
    },
    {
      "from": "0010",
      "to": "0011",
      "label": "/0"
    },
    {
      "from": "0011",
      "to": "0100",
      "label": "/0"
    },
    {
      "from": "0100",
      "to": "0101",
      "label": "/0"
    },
    {
      "from": "0101",
      "to": "0110",
      "label": "/0"
    },
    {
      "from": "0110",
      "to": "0111",
      "label": "/0"
    },
    {
      "from": "0111",
      "to": "1000",
      "label": "/0"
    },
    {
      "from": "1000",
      "to": "1001",
      "label": "/0"
    },
    {
      "from": "1001",
      "to": "1010",
      "label": "/0"
    },
    {
      "from": "1010",
      "to": "1011",
      "label": "/0"
    },
    {
      "from": "1011",
      "to": "1100",
      "label": "/0"
    },
    {
      "from": "1100",
      "to": "1101",
      "label": "/0"
    },
    {
      "from": "1101",
      "to": "1110",
      "label": "/0"
    },
    {
      "from": "1110",
      "to": "1111",
      "label": "/0"
    },
    {
      "from": "1111",
      "to": "0000",
      "label": "/1"
    }
  ]
}
