{
  "schema_version": "state_ir_v1",
  "diagram_type": "state",
  "layout": "free",
  "title": "fig_6_2_11",
  "legend": {
    "state_label": "Q3Q2Q1Q0",
    "edge_label": "/C"
  },
  "states": [
    "0000",
    "0001",
    "0010",
    "0011",
    "0100",
    "0101",
    "0110",
    "0111",
    "1000",
    "1001",
    "1010",
    "1011",
    "1100",
    "1101",
    "1110",
    "1111"
  ],
  "positions": {
    "1110": [100, 55],
    "1111": [170, 55],
    "0000": [240, 55],
    "0001": [310, 55],
    "0010": [380, 55],
    "0011": [450, 55],
    "0100": [450, 135],
    "1011": [530, 95],
    "1010": [600, 95],
    "1101": [530, 175],
    "1100": [600, 175],
    "0101": [380, 215],
    "0110": [310, 215],
    "0111": [240, 215],
    "1000": [170, 215],
    "1001": [170, 135]
  },
  "transitions": [
    { "from": "0000", "to": "0001", "label": "/0" },
    { "from": "0001", "to": "0010", "label": "/0" },
    { "from": "0010", "to": "0011", "label": "/0" },
    { "from": "0011", "to": "0100", "label": "/0" },
    { "from": "0100", "to": "0101", "label": "/0" },
    { "from": "0101", "to": "0110", "label": "/0" },
    { "from": "0110", "to": "0111", "label": "/0" },
    { "from": "0111", "to": "1000", "label": "/0" },
    { "from": "1000", "to": "1001", "label": "/0" },
    { "from": "1001", "to": "0000", "label": "/1" },
    { "from": "1010", "to": "1011", "label": "/0" },
    { "from": "1011", "to": "0100", "label": "/1" },
    { "from": "1100", "to": "1101", "label": "/0" },
    { "from": "1101", "to": "0100", "label": "/1" },
    { "from": "1110", "to": "1111", "label": "/0" },
    { "from": "1111", "to": "0000", "label": "/1" }
  ]
}
